{"evidence_boundary":"LOCAL","completion_claim":"COMPLETED_WITH_PROVIDER_ID_RECEIPT_EXACT_READBACK","case_id":"CASE-INV-LOCAL-AGENT-001","case_version":1,"provider_object_id":"44444444-4444-4444-8444-444444444444","provider_receipt_recorded":true,"exact_same_id_readback_verified":true,"source_truth_claim":"NOT_VERIFIED","original_file_verified":false,"message":"当前账套已核验为 Synthetic Case Company，基础币种 SGD，状态 ACTIVE。提交材料已完整覆盖这一张发票；已按当前授权创建为 DRAFT，金额为未税 SGD 100.00、GST SGD 9.00、含税 SGD 109.00。提供方回执已记录，并已对同一对象 ID 精确回读验证成功。仍未确认：原始文件、上传者及真实世界单据总体完整性；该结果仅证明账套中的 DRAFT 已创建并回读，不代表已过账、正式法律票据或来源真实性已验证。"}