{"evidence_boundary":"LOCAL","completion_claim":"COMPLETED_WITH_PROVIDER_ID_RECEIPT_EXACT_READBACK","case_id":"case-local-agent-invoice-001","case_version":1,"provider_object_id":"44444444-4444-4444-8444-444444444444","provider_receipt_recorded":true,"exact_same_id_readback_verified":true,"source_truth_claim":"NOT_VERIFIED","original_file_verified":false,"message":"已核对当前账套：Synthetic Case Company，状态 ACTIVE，基础币种 SGD。提交集合按本次 Case 记为完整，仅含 1 张发票且无缺失事实。当前授权允许执行，发票 INV-LOCAL-AGENT-001 已成功创建为 Xero DRAFT；已取得 provider receipt，并对同一对象 ID 完成精确读回验证。金额为未税 SGD 100.00、GST SGD 9.00、含税 SGD 109.00。仍未确认：原始文件、上传者及现实世界来源真实性；DRAFT 不等于已过账、已收款、已对账或已结账。"}