{"evidence_boundary":"LOCAL","completion_claim":"COMPLETED_WITH_PROVIDER_ID_RECEIPT_EXACT_READBACK","case_id":"local-agent-customer-invoice-001","case_version":1,"provider_object_id":"44444444-4444-4444-8444-444444444444","provider_receipt_recorded":true,"exact_same_id_readback_verified":true,"source_truth_claim":"NOT_VERIFIED","original_file_verified":false,"message":"已核对当前账套为 Synthetic Case Company，基础币种 SGD，状态 ACTIVE；当前连接具备 xero.read 与 xero.draft.write。该张且仅该张发票已按 Case 版本 1 创建为 DRAFT，金额 SGD 100.00，GST SGD 9.00，含税 SGD 109.00。提供方对象 ID 为 44444444-4444-4444-8444-444444444444，已取得提供方回执并用同一 ID 精确读回验证。仍未确认：原始文件真实性、上传者及现实世界来源集合完整性；DRAFT 也不等同于正式过账。"}