{"evidence_boundary":"LOCAL","completion_claim":"COMPLETED_WITH_PROVIDER_ID_RECEIPT_EXACT_READBACK","case_id":"case-local-agent-20260720-inv-001","case_version":1,"provider_object_id":"44444444-4444-4444-8444-444444444444","provider_receipt_recorded":true,"exact_same_id_readback_verified":true,"source_truth_claim":"NOT_VERIFIED","original_file_verified":false,"message":"核对完成：当前账套为 Synthetic Case Company，状态 ACTIVE，基础币种 SGD。提交集合按限定范围为完整 1/1，材料金额为未税 100.00、GST 9.00、含税 109.00，缺失事实 0。已按当前授权成功创建 1 张客户发票 DRAFT，并取得提供方回执及同一对象 ID 的精确回读。该 DRAFT 在本环境中仍属未过账状态。未能确认：原始文件、上传者、真实法律票据真实性，以及账套外现实世界来源的完整性；本次仅确认提交集合本身完整，未进行 Trial Balance、对账或结账确认。"}