{"evidence_boundary":"LOCAL","completion_claim":"COMPLETED_WITH_PROVIDER_ID_RECEIPT_EXACT_READBACK","case_id":"case-local-agent-invoice-001","case_version":1,"provider_object_id":"44444444-4444-4444-8444-444444444444","provider_receipt_recorded":true,"exact_same_id_readback_verified":true,"source_truth_claim":"NOT_VERIFIED","original_file_verified":false,"message":"当前账套已核验为 Synthetic Case Company，本位币 SGD。提交集合按本次提交范围完整覆盖 1 张测试客户发票，金额校验为未税 SGD 100.00、GST SGD 9.00、含税 SGD 109.00。当前授权允许执行，发票已成功创建为 DRAFT；提供方回执已记录，并已对同一对象 ID 精确回读验证。仍未确认：原始文件、上传者及现实业务来源真实性未验证；DRAFT 不是已过账、已收款或已对账状态；“提交集合完整”不代表整个业务或期间资料完整。"}