{"evidence_boundary":"LOCAL","completion_claim":"NOT_COMPLETED","case_id":"UNVERIFIED","case_version":1,"provider_object_id":"UNVERIFIED","provider_receipt_recorded":false,"exact_same_id_readback_verified":false,"source_truth_claim":"NOT_VERIFIED","original_file_verified":false,"message":"未完成：本环境未提供读取必需挂载 Skill（prepare-balanced-accounting-entry / execute-approved-accounting-entry）内容的能力。按会计工作流要求，在 Skill 无法加载时必须停止，因而未读取账套、未准备 Case、未执行创建，也未运行 shell 或读取仓库文件。"}